{
  "$schema": "./schemas/identity.schema.json",
  "name": {
    "full": "Jaden Bruha",
    "display": "Jaden Bruha",
    "title": "Technical Engineer",
    "professional_title": "Software Engineer"
  },
  "portrait": {
    "path": "/resources/portrait.jpg",
    "alt": "Jaden Bruha Portrait"
  },
  "hero": {
    "animation_left": "I'm Jaden Bruha",
    "animation_right": "A Technical Engineer"
  },
  "bio": {
    "tldr": "TLDR; I am Jaden Bruha, I'm a 22 year old new-grad, and I'm a very nerdy engineer with big aspirations.",
    "full": "I have a passion for building anything and everything from software, computers to serve my software, AI agents, and motorcycles. My journey started at a young age as a hobbyist, and I've grown into a full stack developer striving for elegant solutions. My current fixations include learning about quantum philosophy, parallelized programming, and artificial (general) intelligence."
  },
  "experience_summary": "Full-stack software engineer with experience building modern web applications and AI-powered systems. Proficient in developing scalable backend services, responsive frontend interfaces, and integrating cutting-edge AI/ML capabilities.\n\nKey accomplishments:\n- Built production AI agents using LangChain and LangGraph\n- Developed full-stack applications with React/Next.js and FastAPI\n- Implemented real-time streaming features using SSE and WebSockets\n- Designed and deployed containerized microservices architecture\n- Created RAG systems for intelligent document processing",
  "strengths": [
    "Fast learner who quickly adapts to new technologies",
    "Strong problem-solving and debugging skills",
    "Experience with end-to-end software development lifecycle",
    "Excellent communication and collaboration abilities",
    "Passionate about building AI-powered applications"
  ],
  "career_interests": [
    "Full-Stack Development",
    "AI/ML Engineering",
    "Backend Systems",
    "Cloud Architecture",
    "Developer Tools"
  ]
}
